category,question
HISTORY,"On May 29, 1765 Patrick Henry's Stamp Act protest was interrupted with this one word"
HISTORY,It became a U.S. territory in 1900 & a state 59 years later
HISTORY,Susan B. Anthony was arrested in 1872 for doing this
HISTORY,In 1949 Henry H. Arnold became the first general of this branch of the armed forces
HISTORY,In April 1984 this U.S. government agency admitted its role in the mining of Nicaraguan harbors
HISTORY,John Hancock held this political position from 1780-85 & from 1787-93
HISTORY,In December 1974 this former New York governor was sworn in as Vice President
HISTORY,"In 1951 he told a joint session of congress that he ""tried to do his duty as god gave him the light to see that duty"""
HISTORY,This political party founded around 1789 stood for a strong central government
HISTORY,His foes said that in 1877 he agreed to withdraw remaining federal troops from the south in return for electoral support
HISTORY,"In 1917 the U.S. purchased the islands of St. Croix, St. John & St. Thomas from this country for $25 million"
HISTORY,"In 1791 this Treasury Secretary issued his ""Report On Manufactures"", a critique of American industry"
HISTORY,"When West Virginia became a state in 1863, Wheeling was its capital; this city became the permanent capital in 1885"
HISTORY,"In 1698, after an absence of 15 years, he returned to the colony named for his father"
HISTORY,"On Aug. 2, 1826 at Boston's Faneuil Hall, this great orator delivered a eulogy on Jefferson & Adams"
HISTORY,"Completed in 1856, California's first railroad ran 22 miles between Sacramento & this prison city"
HISTORY,"Between 1856 & 1860, 2,962 of this faith set out from Iowa & Nebraska to Utah in the Handcart Migration"
HISTORY,"On April 2, 1917 President Wilson told Congress, ""The world must be made safe for"" this"
HISTORY,"On April 20, 1971 the U.S. Supreme Court upheld this transportation method as a way to achieve school integration"
HISTORY,"John O'Sullivan, who later became a diplomat, coined this term for the USA's right to cover the continent"
HISTORY,In 1798 Congress passed this collection of bills to control domestic dissent & conspiracy against the federal govt.
HISTORY,British commander Sir Edward Pakenham was killed in this battle fought 2 weeks after the War of 1812
HISTORY,"To reach eastern markets in the 1800s, Texas drovers brought their cattle to Kansas via this trail"
HISTORY,"On November 14, 1889, the New York World called her trip, ""The Longest Journey Known to Mankind"""
HISTORY,"On Mar. 27, 1964 this largest Alaska city was hit by an 8.4 earthquake"
HISTORY,In 1787 Arthur St. Clair became the first governor of this vast territory north of the Ohio River
HISTORY,This statue got a new torch in 1986; the old one was 100 years old
HISTORY,"Term for the women of the 1920s who wore bobbed hair, short dresses & long strings of beads"
HISTORY,"This Sunshine State once had east & west portions; the western part now belongs to Ala., Miss. & La."
HISTORY,"In 1899 President McKinley took a turn in the Locomobile, a car made by Stanley & propelled by this"
HISTORY,Andrew Jackson was one of the landowners who founded this Tennessee town overlooking the Mississippi in 1819
HISTORY,Victor Marie du Pont served as a captain of this state's volunteers in the War of 1812
HISTORY,"When this convened in May 1787, Adams was in London, Jefferson was in Paris & Patrick Henry refused to attend"
HISTORY,Americans began to oocupy this even before we could send Russia the $7.2 million we paid for it
HISTORY,He was the only member of the Warren Commission who would later face would-be assassins himself
HISTORY,In 1818 U.S. troops sacked Pensacola as they marched into this Spanish territory; soon it was ours
HISTORY,"African Americans, 13% of the U.S., were nearly twice that percentage of U.S. troops in this 1990-91 war"
HISTORY,In 1960 the last of these locomotives was retired from general use in the U.S. & Diesel ones took over
HISTORY,In the 1600s most of New York State was occupied by this Native American confederacy
HISTORY,"In 1899 Secretary of State John Hay proclaimed this ""welcoming"" policy to preserve U.S. trading rights in China"
HISTORY,"2 years after exploring the Northwest with William Clark, he was named gov. of the Louisiana territory"
HISTORY,"This group of volunteers, created on Mar. 1, 1961, works to improve living conditions in other nations"
HISTORY,"On April 24, 1980 an attempt to rescue 53 hostages in this capital city was called off"
HISTORY,"'Ullo, Gouverneur!  This signer of the Constitution gave the document its final wording"
HISTORY,"On Dec. 9, 1992, the first group of U.S. Marines arrived in this African nation to restore order"
HISTORY,From 1804 to 1806 this pair explored the area between the Mississippi River & the mouth of the Columbia River
HISTORY,"On March 10, 1977, this Cesar Chavez labor group signed an agreement with the Teamsters union"
HISTORY,In 1920 this president signed legislation returning the railroads to private ownership
HISTORY,"The Kansas-Nebraska Act of 1854 repealed this ""compromise"" of 1820"
HISTORY,The government leasing oil reserves to Mammoth Oil in 1922 caused this scandal the next year
HISTORY,In 1787-88 the Anti-Federalists opposed the ratification of this document
HISTORY,"After a defeat in 1835 for reelection to Congress from Tennessee, this frontiersman moved to Texas"
HISTORY,A Ute legend says the Great Spirit created all life on this peak discovered in 1806
HISTORY,Nickname given in the 1930s to the area seen here in a famous Arthur Rothstein photo
HISTORY,"When he began his Progressive Party, Teddy Roosevelt said he felt as fit as one of these animals"
HISTORY,In 1961 he became the first brother of a president appointed to a cabinet position
HISTORY,"On January 21, 1977 this president pardoned several thousand Vietnam War draft evaders"
HISTORY,In 1915 this Hull House founder helped establish the Women's International League for Peace & Freedom
HISTORY,"On June 21, 1982 he was found not guilty by reason of insanity in the shooting of President Reagan"
HISTORY,"In searching for the 7 Cities of Cibola, he & his men traveled as far north as present-day Lyons, Kansas"
HISTORY,"On April 14, 1865 Abraham Lincoln authorized this govt. agency; its main job then was to protect against counterfeiting"
HISTORY,Captain John Smith became president of this Virginia colony's council in September 1608
HISTORY,He served as the first chief justice of New York before he became first chief justice of the U.S.
HISTORY,"It was necessary for George Washington to surrender Fort Necessity July 3, 1754, during this war"
HISTORY,"This president's political enemies referred to him as the ""Beast of Buffalo"""
HISTORY,"Aaron Burr & Molly Pitcher distinguished themselves at the June 28, 1778 battle of this"
HISTORY,"This legislative body first met on March 4, 1789 in New York City, but only 8 of its 22 members were present"
HISTORY,"Henry Laurens, Thomas Mifflin & Richard Henry Lee were presidents of this body that only lasted for about 15 years"
HISTORY,"On April 18, 1775 he was captured by the British but released; he had to walk back to Lexington"
HISTORY,"On September 8, 1974, he was granted ""A full, free and absolute pardon"""
HISTORY,"FDR's statement ""The United States of America was...deliberately attacked by...Japan"" was made on this date"
HISTORY,"In 1824 Andrew Jackson received more popular & electoral votes, but the House declared this man president"
HISTORY,Hostilities in the Spanish-American War ended when Manila surrendered to General Merritt & this admiral
HISTORY,"This pact among the U.S., Mexico & Canada took effect in 1994 & aims to eliminate tariffs by 2008"
HISTORY,In the 1880s the Knights of this gave way to the American Federation of this representing workers
HISTORY,"In 1849, Thomas Ewing, ""The Logician of the West"", became the USA's first Secy. of this Cabinet Dept."
HISTORY,"This committee that once claimed 800,000 members was dissolved Dec. 11, 1941"
HISTORY,Gen. Charles Lee was relieved of command after ordering a retreat at this 1778 New Jersey battle
HISTORY,"Because of the potato famine, more than a million emigrated from this country to the U.S. in the mid-1800s"
HISTORY,This 1803 land acquisition included area in what is now 13 of the 50 states
HISTORY,"After winning the disputed 1876 election, he was inaugurated to cries of ""Rutherfraud"""
HISTORY,In 1730 he assumed full ownership of the Pennsylvania Gazette
HISTORY,"Famous for his debates with Lincoln, he served as a U.S. senator from Illinois from 1847 to 1861"
HISTORY,"During his first term as president, the Bill of Rights became law"
HISTORY,In 1813 the U.S. defeated the British in the Battle of the Thames River in what is now this country
HISTORY,"In 1832 this president declared, ""The bank, Mr. Van Buren, is trying to kill me; but I will kill it"""
HISTORY,In November 1689 Joseph Wadsworth hid this colony's charter from the British by placing it in an oak tree
HISTORY,He earned his captain's commission by burning the Philadelphia at Tripoli in 1804
HISTORY,"At the outbreak of hostilities of the Civil War, he was president of the Senate"
HISTORY,The Philadelphia Centennial Exposition celebrated the 100th anniversary of this document
HISTORY,"On March 27, 1964, North America's most intense recorded earthquake, an 8.4, hit this state"
HISTORY,"1 of 3 men who, under the name ""Publius"", wrote ""The Federalist"" essays urging ratification of the Constitution"
HISTORY,Just before WWII this British king & his queen Elizabeth became the 1st British monarchs to visit the U.S.
HISTORY,In 1982 Central High School was made a national landmark in memory of 1957 events there
HISTORY,"While in the VA. legislature, this 3rd president introduced his religious freedom statute"
HISTORY,"Founded in 1607, the Popham colony on the Kennebec River was this state's first English settlement"
HISTORY,In 1952 composer Stuart Hamblen was the presidential candidate of this anti-liquor party
HISTORY,"On Dec. 23, 1921 President Harding pardoned this Socialist so that he could have Christmas dinner with his wife"
HISTORY,This soldier & frontiersman won important victories over the British in the Northwest Territory
HISTORY,"Francisco Lopez found this precious metal in California in 1842, before the rush"
HISTORY,"In 1843 Congress allocated $30,000 to string one between Baltimore & Washington; it was completed in 1844"
HISTORY,In 1873 President Grant proclaimed this city the site of the Centennial Exposition of 1876
HISTORY,"Before cotton became king, this plant that yields a violet dye was a popular southern crop"
HISTORY,"In May 1692 this village's jails were filled with witchcraft suspects, eventually totaling 150"
HISTORY,In 1900 Sanford B. Dole became the first governor of this U.S. territory
HISTORY,"During the naval battle for this Alabama bay, David Farragut uttered, ""Damn the torpedoes!  Full speed ahead!"""
HISTORY,"In 1888 he won the presidency using the campaign song ""Grandfather's Hat Fits Ben"""
HISTORY,"During the War of 1812, he had command of 3 brigs, 5 schooners & a sloop on Lake Erie"
HISTORY,"Shrapnel from a 1916 munitions storage plant explosion in Jersey City, NJ damaged this famous statue"
HISTORY,"Frances Perkins was trying to improve working conditions in these in the 1910s, Kathie Lee in the '90s"
HISTORY,The U.S. made this great buy from France in 1803 & would have been happy with just New Orleans
HISTORY,"If this act hadn't passed July 14, 1798, we would have had just the Alien Acts"
HISTORY,In 1844 John C. Fremont crossed the Sierra Nevada & this John C. became Secretary of State
HISTORY,"In 1805 this territory was created from the Indiana one, with all or parts of the lower & upper peninsulas"
HISTORY,In May 1980 at least 26 people were killed when this volcano in Washington erupted
HISTORY,"In September 1664 this governor of New Amsterdam surrendered to the British, ending Dutch power in the New World"
HISTORY,"(<a href=""http://www.j-archive.com/media/2002-02-25_J_04.jpg"" target=""_blank"">Cheryl of the Clue Crew reports from Gettysburg Cemetery.</a>) In 1863, Lincoln dedicated this cemetery by saying that ""we cannot consecrate--we cannot"" do this to ""this ground"""
HISTORY,A 1963 treaty with Mexico settled a boundary dispute between Ciudad Juarez & this Texas city
HISTORY,"Famous 1863 speech by President Lincoln that began, ""Four score and seven years ago..."""
HISTORY,It's the year America celebrated its bicentennial
HISTORY,"Davy Crockett was among nearly 200 men who died defending this mission-fortress in San Antonio, Texas"
HISTORY,"After journeying 4,000 miles, this pair's expedition finally reached the Pacific Ocean in November 1805"
HISTORY,During Bacon's Rebellion in 1676 this 1st permanent English settlement in America was burned to the ground
HISTORY,"A 1928 campaign slogan promised this ""in every pot and a car in every garage"""
HISTORY,"Years of political rivalry led to the July 11, 1804 duel between these 2 men"
HISTORY,In 1776 this silversmith set up a mill to make gunpowder after the colonists ran out of it at Bunker Hill
HISTORY,"The Confederate States of America were established in 1861 in this city, the first Confederate capital"
HISTORY,This leader of the Green Mountain Boys was a champion for the creation of the Green Mountain State
HISTORY,"By 1942 FDR had appointed 7 new men to this body: it took a while, but he got the packing he had wanted"
HISTORY,"Congress adopted this document in 1777, but it was not fully ratified by the states for another 4 years"
HISTORY,"Slaves, molasses & rum were exchanged in the 3 arms of the colonial practice known as this ""trade"""
HISTORY,"""Our flag still waves proudly from the walls"", William B. Travis said of it, ""I shall never surrender or retreat"""
HISTORY,"(<a href=""http://www.j-archive.com/media/2010-10-27_DJ_18.wmv"">Jimmy of the Clue Crew presents the clue on a map.</a>)  The Oregon Trail started at Independence, Missouri and crossed the Great Plains by following this river"
HISTORY,Nixon's Att'y-Gen. E. Richardson resigned & Watergate prosecutor A. Cox was fired on this night of the week
HISTORY,"John Jay, not John Marshall, was the first one"
HISTORY,"After the original 13, this was the 1st state admitted to the union"
HISTORY,These 2 self-governing outlying areas of the U.S. were acquired from Spain in 1898
HISTORY,"In his 1835 book ""Democracy in America"", this Frenchman predicted the present age's 2 superpowers"
HISTORY,Escaped slaves in the 1850s & draft dodgers in the 1960s mainly headed to this country
HISTORY,"On Feb. 15, 1901 Carry Nation wrecked one of these establishments with a hatchet"
HISTORY,"A fire in 1851 destroyed some 35,000 volumes in its collection"
HISTORY,"In the first census conducted in 1790, this state, with nearly 692,000 people, was the most populous"
HISTORY,"Seen <a href=""http://www.j-archive.com/media/2004-11-01_J_13.jpg"" target=""_blank"">here</a> at a Senate hearing, he was the first U.S. Attorney General to be convicted of a felony"
HISTORY,"14 years before coming to America, this Quaker was imprisoned in the Tower of London for his beliefs"
HISTORY,In 1949 the U.S. joined this Western defense pact; our 1st ever peacetime alliance
HISTORY,"It's now thought that an internal explosion, not a mine, caused this ship to sink in Havana Harbor in 1898"
HISTORY,This settlement's economy grew after John Rolfe found that tobacco could be successfully grown there
HISTORY,"19th century term for the belief that U.S. expansion across North America was ""destined by God"""
HISTORY,"Custer's Last Stand is also known by the oxymoronic name ""Little Big"" this"
HISTORY,"In the 1950s, if your button said, ""I Like Ike"", he was your man"
HISTORY,"Born in Tennessee, Davy Crockett died in what's now this state"
HISTORY,"William Cody's 2-word nickname, or perhaps what he sent out to his clients at the end of each month"
HISTORY,"Contrary to myth, Washington didn't throw one of these across the Potomac; there weren't any when he was young"
HISTORY,"In 1774 New Jerseyites dressed as Indians burned this in Greenwich; a similar ""Party"" occurred earlier in Boston"
HISTORY,"In 1901 the Senate ratified the Hay-Pauncefote Treaty, allowing the U.S. to build this in Central America"
HISTORY,"On May 1, 1898 Commodore Dewey defeated the Spanish Pacific fleet at the battle of this Philippine bay"
HISTORY,"On May 10, 1692 this colony founded by Cecil Calvert made the Anglican Church its official church"
HISTORY,In 1939 this state finally finished paying off a $12.4-million debt to the state from which it had separated
HISTORY,Nickname given the WWII backyard vegetable patches
HISTORY,"In May of 1780, Gen. Benjamin Lincoln was forced to surrender this South Carolina port to the British"
HISTORY,More than 200 U.S. Marines were killed in 1983 by a truck bomb at their barracks in this Mideast capital
HISTORY,"He related the story of Pocahontas in his ""General History of Virginia"" in 1624"
HISTORY,"The Battle of Palo Alto, fought May 8, 1846, was the first battle of this war"
HISTORY,"On February 15, 1898 the U.S. battleship Maine blew up in this Cuban capital's harbor"
HISTORY,"This ""King of the Wild Frontier"" once claimed to have killed 105 bears during a few months in 1825"
HISTORY,"The ""War on"" this, approved by Congress in August of 1964, included VISTA, Volunteers in Service to America"
HISTORY,"What's known as the second of these programs began with FDR's January 4, 1935 message to Congress"
HISTORY,John Smith was among the early members on the Council of Seven that governed this Virginia colony
HISTORY,This volunteer group was born in may 1898 near the bar in San Antonio's Menger Hotel; it existed for just 133 days
HISTORY,In November 1620 John Carver was elected the first governor of this colony
HISTORY,In 1933 this Republican began serving the first of his 2 terms as governor of Kansas
HISTORY,"While serving in this cabinet post, Edward R. Stettinius, Jr. signed the U.N. charter for the U.S. June 26, 1945"
HISTORY,"In June 1967 LBJ met with this Soviet premier in Glassboro, N.J. to discuss world problems"
HISTORY,"On September 14, 1847, this general led the American army into Mexico City"
HISTORY,This 1803 acquisition doubled the size of the U.S.
HISTORY,"Though he said he found dueling abhorent, he participated in one in 1804"
HISTORY,"In 1912, it became 48th & last contiguous state to join The Union"
HISTORY,"1st to hold a nominating convention, this 3rd party ironically chose Mason Wm. Wirt to run for Pres."
HISTORY,"Upon leading 1894 march of unemployed on Washington, Jacob Coxey was arrested for this trivial of offenses"
HISTORY,"On Nov. 11, 1918, Pvt. Henry Gunther became the last American casualty in this war"
HISTORY,"Remarkably, there were more than 60 survivors when this Zeppelin crashed in New Jersey in 1937"
HISTORY,"Elected the 19th U.S. president in 1876, Rutherford B. Hayes was a member of this political party"
HISTORY,"(Sofia of the Clue Crew at the Ronald Reagan Library)  This man awarded the Medal of Freedom to Ronald Reagan on January 13, 1993"
HISTORY,"This Indian ""king"" for whom a war against American colonists was named was tracked down & killed in 1676"
HISTORY,This 1876 battle in Montana is also known as Custer's Last Stand
HISTORY,In the late 1600s this Asian grain became the main crop of the Carolina coastal lowlands
HISTORY,"In 1972 George McGovern called this president's administration the ""most corrupt"" in U.S. history"
HISTORY,In 1813 this hero of Tippecanoe defeated Tecumseh at the Thames River in Canada
HISTORY,In 1664 the Duke of York granted land west of the Hudson River to his supporters; it was named this
HISTORY,"History was made on December 1, 1955 when bus driver James Blake called the police & had this person arrested"
HISTORY,You're in the Army now--in 1940 FDR instituted the first peacetime one of these in U.S. history
HISTORY,"This term for a mechanical device can also be an organization running city politics, like NYC's Tammany Hall"
HISTORY,Edward Brooke was the first African American to hold this post for a state; Eric Holder is the first federal one
HISTORY,"<a href=""http://www.j-archive.com/media/2009-10-15_J_09.jpg"" target=""_blank"">Buzz Aldrin & Jim Lovell</a> do look like <a href=""http://www.j-archive.com/media/2009-10-15_J_09a.jpg"" target=""_blank"">twins</a> as they prepare for a mission in this 1960s program"
HISTORY,This man's 1807 steamboat run up the Hudson led to an 1824 Supreme Court decision on interstate commerce
HISTORY,"In 1953, this island's first year as a U.S. commonwealth, 75,000 residents moved to the mainland"
HISTORY,"This president collapsed September 25, 1919 & one week later suffered a stroke"
HISTORY,In 1609 Champlain reached the lake now named for him on the border of New York & this state
HISTORY,"In 1903 this ""Badger State"" became the first to adopt direct primary elections"
HISTORY,"On December 2, 1863, ground was broken in Omaha for the construction of this railroad"
HISTORY,"On the night of April 14, 1986, U.S. warplanes bombed Tripoli & Benghazi in this African country"
HISTORY,"Traffic on this trail between San Antonio & Abilene peaked in 1871 with 600,000 cattle"
HISTORY,"Until the late 1840s, this largest North Carolina city was the USA's chief source of gold"
HISTORY,"At the same time that John Foster Dulles was Secretary of State, his brother Allen headed this agency"
HISTORY,19 members of this Irish-American terrorist society active in 1870s Pennsylvania were hanged
HISTORY,"In the last week of the John Tyler administration, this republic was offered statehood"
HISTORY,In September 1964 the Warren Commission concluded that he acted alone in JFK's assassination
HISTORY,"On December 20, 1860, as a result of Lincoln's election, this state seceded from the Union"
HISTORY,"Fleeing the capital on August 24, 1814, she took a Gilbert Stuart portrait of Washington with her"
HISTORY,In 1916 President Wilson sent this brigadier general into Mexico in pursuit of Pancho Villa
HISTORY,In 1932 this Republican was elected governor of Kansas; he won reelection in 1934
HISTORY,"On May 22, 1906 they received a patent for an improved model of their airplane"
HISTORY,"Samuel Adams referred to this April 19, 1775 battle when he said, ""What a glorious morning for America!"""
HISTORY,"Prior to his election to the Tennessee legislature in 1821, this frontiersman was a Justice of the Peace"
HISTORY,"1 of 4 freedoms FDR termed essential in a January 6, 1941 address to Congress"
HISTORY,"Of the 3 writers of the Federalist papers, 2 were New Yorkers & he was a Virginian"
HISTORY,"On Nov. 9, 1906 Teddy Roosevelt left the U.S. to personally see the progress on this engineering project"
HISTORY,"The British party of this name aimed to limit the king's powers; the U.S. party hoped to limit ""King Andrew"" Jackson"
HISTORY,"(<a href=""http://www.j-archive.com/media/2010-10-18_J_26.jpg"" target=""_blank"">Sarah of the Clue Crew shows a map of New England on the monitor.</a>) In May 1643, to discourage attacks by the Dutch & others, the United Colonies of New England was formed by 4 Puritan colonies: Massachusetts Bay, Connecticut, New Haven & <a href=""http://www.j-archive.com/media/2010-10-18_J_26a.jpg"" target=""_blank"">this</a> one"
HISTORY,"On May 15, 1972 while campaigning in Laurel, Md., this Alabama governor was shot & paralyzed by Arthur Bremer"
HISTORY,In 1948 Whittaker Chambers implicated this State Department official as an espionage agent for the Soviets
HISTORY,"I've had it ""on my mind"" that this state has joined the Union 3 times, in 1788, 1868 & 1870"
HISTORY,A federal law from 1950 prohibited the labeling of colored oleo as this
HISTORY,The Dept. of Agriculture began a new version of this program in 1964; by 1975 it was helping over 17 million people
HISTORY,"This commodore became a friend to Japan in 1854, showing them the telegraph & a daguerreotype camera"
HISTORY,"Name that completed an 1856 Republican slogan, ""Free soil, free speech, free men and ..."""
HISTORY,"This state's been ""on my mind"" since it entered the Union 3 times, in 1788, 1868 & 1870"
HISTORY,In 1913 the 16th Amendment was passed allowing Congress to collect taxes on this
HISTORY,"Fleeing the capital on August 24, 1814, she took a Gilbert Stuart portrait of Washington with her"
HISTORY,Guerrilla leader Francis Marion earned this nickname for his daring raids from the South Carolina marshes
HISTORY,"Name that completed an 1856 Republican slogan, ""Free soil, free speech, free men and..."""
HISTORY,"15 indentured servants were aboard this ship when it sailed for the new world, Sept. 16, 1620"
HISTORY,"He was hanged in Charlestown, Virginia about 6 weeks after he led the attack on Harper's Ferry"
HISTORY,In 1834 Stephen Austin was held in prison for 8 months in this country
HISTORY,In 1818 this general ordered 2 traders arrested & executed for inciting the Seminole Indians
HISTORY,"This Oglala Sioux chief was fatally stabbed Sept. 5, 1877 at Fort Robinson, Nebraska"
HISTORY,"When the British approached, the Concord Militia didn't know about the skirmish at this place earlier that day"
HISTORY,"WWI sales of ""Liberty"" these, whose posters showed the statue, raised more than $15 billion"
HISTORY,You didn't want to make the mistake of following the south instead of the north platte on this pioneer trail
HISTORY,The U.S. supplied materiel to its allies during WWII through this 1941 Congressional act
