category,question
LITERATURE,"This 1877 novel was written ""to induce kindness, sympathy and an understanding treatment of horses"""
LITERATURE,"In 1938 actor Orson presented this novelist's ""The War of the Worlds"" on radio"
LITERATURE,"On his fifth voyage, he encounters the Old Man of the Sea"
LITERATURE,"In this F. Scott Fitzgerald novel, Myrtle Wilson is accidentally run over & killed by Daisy Buchanan"
LITERATURE,This E.M. Forster novel is set in the fictional city of Chandrapore
LITERATURE,"In his 1938 work ""The Unvanquished"", the Sartoris family copes with the Civil War"
LITERATURE,In the 1600s Basho wrote a famous hard-to-translate haiku about this creature jumping into a pond
LITERATURE,The infamous Lowood School in this novel was based on a real school that Charlotte Bronte attended at age 8
LITERATURE,"This Jane Austen novel begins, ""The family of Dashwood had been long settled in Sussex"""
LITERATURE,"After Christian's death in an 1897 drama, this title character still acts as a platonic friend to the widow"
LITERATURE,"Tolstoy wrote this character's ""life had been most simple and most ordinary and therefore most terrible"""
LITERATURE,"In this Dante work, the poet is given a tour through hell, purgatory & paradise"
LITERATURE,"This author of ""No Exit"" said no to a Nobel Prize in 1964"
LITERATURE,This Flaubert title character commits suicide because of mounting debt & lies told to her husband Charles
LITERATURE,"In the epic poem ""Beowulf"", Beowulf destroys this monster by tearing off his arm"
LITERATURE,"This 1872 Samuel Butler satire has the alternate title ""Over The Range"""
LITERATURE,1719 novel about a mariner who lived 8 & 20 years all alone in an uninhabited island
LITERATURE,"Cervantes' Alonso Quijano changes his name to this, after reading romances of chivalry"
LITERATURE,"This author introduced detective Mike Hammer in ""I, The Jury"""
LITERATURE,"Although married to Alexei, she falls in love with the handsome Count Vronsky"
LITERATURE,"Meursault is the rather cold, effectless narrator of this Camus novel"
LITERATURE,In this Poe tale Captain Kidd's treasure is found with the aid of a secret code & a scarab beetle
LITERATURE,"Published in 1961, ""The Winter of"" this was John Steinbeck's last novel"
LITERATURE,Carolyn Meeber is the title character of this Theodore Dreiser novel
LITERATURE,"In this Truman Capote novella, the story of Holly Golightly is narrated by Fred, a struggling writer"
LITERATURE,This Kipling orphan's father was a sergeant in an Irish regiment in the Punjab
LITERATURE,This title French schoolgirl created by Ludwig Bemelmans is often found at the end of the line
LITERATURE,"In the title of a 14th century work, Sir Gawain is paired with this ""knight"""
LITERATURE,"A rundown Mexican hotel is the setting for ""The Night of the Iguana"", a play by this writer"
LITERATURE,"This 1942 French novel begins, ""Mother died today.  Or, maybe, yesterday; I can't be sure."""
LITERATURE,"Despite its title, this 1848 Charles Dickens novel is ultimately about a father & his daughter, not his son"
LITERATURE,"Readers in 1860-61 picked up copies of ""All The Year Round"" to read installments of his ""Great Expectations"""
LITERATURE,Time in this futuristic Aldous Huxley novel is measured from the invention of the Model T Ford
LITERATURE,"This 1975 E.L. Doctorow novel relates the story of Coalhouse Walker Jr., who's harassed by local firemen"
LITERATURE,"Saul Bellow's title character whose ""gift"" to Charlie Citrine was a sense of hope"
LITERATURE,"Willa Cather's ""My Antonia"", ""O Pioneers!"" & ""A Lost Lady"" are set on the frontier in this midwestern state"
LITERATURE,"Edgar Rice Burroughs wrote that he ""lived on in his wild, jungle existence with little change for several years"""
LITERATURE,"His 1926 novel ""The Sun Also Rises"" has been published in England as ""Fiesta"""
LITERATURE,"""The Tale of the Flopsy Bunnies"" was a follow-up to her stories of Peter Rabbit & Benjamin Bunny"
LITERATURE,She made Tom Sawyer whitewash her fence
LITERATURE,"This title home of a Hawthorne tale has ""an elm-tree of wide circumference, rooted before the door"""
LITERATURE,"An edition of this 1934 book had on its cover a crab & ""Not to be imported into Great Britain or U.S.A."""
LITERATURE,"This character writes, ""Tom and me found the money that the robbers hid....we got six thousand dollars apiece"""
LITERATURE,Ernest Hemingway's only Pulitzer Prize came in 1953 for this short novel about a Cuban named Santiago
LITERATURE,"In this allegory, Christian uses a key called Promise to escape from the Doubting Castle"
LITERATURE,"In a Dickens novel, this title character's mother Clara unfortunately marries Mr. Murdstone"
LITERATURE,"The character Jesse B. Semple figures prominently in many of this ""Harlem"" poet's short stories"
LITERATURE,"In 1922 he published ""The Red House Mystery""; in 1928 ""The House At Pooh Corner"""
LITERATURE,Mr. Kurtz is an agent of a Belgian Congo trading station in this Joseph Conrad novella
LITERATURE,"This western author stopped using pen names soon after the publication of ""Hondo "" in 1953"
LITERATURE,"""The Big Knockover"", a collection of his stories & short novels, was edited by Lillian Hellman"
LITERATURE,"His novel ""Cancer Ward"" originally was banned in the Soviet Union"
LITERATURE,"1st name of the Maugham title character ""Miss Thompson"""
LITERATURE,Brom Bones dressed up as this to scare the schoolmaster away from Katrina
LITERATURE,"Daniel Defoe title character who was a tart, a wife, a thief, a convict, then grew rich & lived honest"
LITERATURE,"""Requiem for a Nun"" was his sequel to ""Sanctuary"""
LITERATURE,"In his 1940 classic Western novel, Walter Van Tilburg Clark sets his ""Incident"" in this valley"
LITERATURE,E.B. White spun this tale about a spider & a pig
LITERATURE,"In this Edgar Allan Poe poem, the title bird's favorite word is ""nevermore"""
LITERATURE,"Dickens divided this book into staves instead of chapters; Stave IV is called ""The Last of the Spirits"""
LITERATURE,"If you're in the ""hobbit"" of reading his books, try his non-hobbit tale ""Farmer Giles Of Ham"""
LITERATURE,"In ""Little Women"", this youngest of the 4 sisters is ""a most important person, in her own opinion at least"""
LITERATURE,"The Bermoothes, where Prospero's brother was shipwrecked in this play, might have been named for Bermuda"
LITERATURE,"This dilapidated Hawthorne mansion is home to Pyncheon relatives Hepzibah, Phoebe & Clifford & a lodger"
LITERATURE,A dog named Jip chews up the cookbook belonging to this Dickens title character's wife Dora
LITERATURE,The wife of this Sinclair Lewis research scientist dies during an epidemic in the West Indies
LITERATURE,"(<a href=""http://www.j-archive.com/media/2001-10-04_DJ_25.jpg"" target=""_blank"">Jimmy of the Clue Crew reports from a water theme park.</a>)  Hey, we can be this title duo from a Lewis Carroll poem"
LITERATURE,"His stores include ""The Man Who Was"" and ""The Man Who Would Be King"""
LITERATURE,"John Galsworthy's 1906 work ""The Man of Property"" was the first in this series of novels"
LITERATURE,"This 1852 work was subtitled ""Life Among the Lowly"""
LITERATURE,"In this Ernest Hemingway story, an author awaits death while on an African safari"
LITERATURE,This 1837 Nathaniel Hawthorne collection contained 39 of his stories
LITERATURE,"This 1897 novel contains the line ""At sunrise the Count could appear in his own form"""
LITERATURE,"This 14th century work is divided into 3 sections: ""Inferno"", ""Purgatorio"" & ""Paradiso"""
LITERATURE,"Dickens said this title character was ""born at Blunderstone, in Suffolk"" as a ""posthumous child"""
LITERATURE,"This 1861 George Eliot novel is subtitled ""The Weaver of Raveloe"""
LITERATURE,"At the beginning of Orwell's ""Animal Farm"", Major Snowball & Napoleon are pigs who live on this farm"
LITERATURE,This Stephen Crane novel is set during the Battle of Chancellorsville
LITERATURE,"In an Anthony Hope novel, King Rudolf is ""The Prisoner Of"" this castle in Ruritania"
LITERATURE,"Novel in which an old seaman sings, ""Fifteen men on the dead man's chest --- Yo--Ho--Ho, and a bottle of rum"""
LITERATURE,"This Raymond Chandler private eye was introduced in the 1939 novel ""The Big Sleep"""
LITERATURE,"Poe's ""The Mystery of Marie Roget"" was a sequel to this story featuring detective C. Auguste Dupin"
LITERATURE,"Chapter one of this book informs us that ""There was unquestionably a Chuzzlewit in the Gunpowder Plot"""
LITERATURE,"Originally, the term Picaresque referred to fiction from this country about rogues called Picaros"
LITERATURE,"The last chapter of this Charlotte Bronte novel begins with the words ""Reader, I married him"""
LITERATURE,"In a poem dedicated to this lord, Longfellow wrote, ""Poet!  I come to touch thy lance with mine"""
LITERATURE,"A category called Famous Andres would have to include this Frenchman who wrote ""Man's Fate"" & ""Man's Hope"""
LITERATURE,"At the end of this novel, Reverend Dimmesdale reveals publicly that he is the father of Hester Prynne's daughter"
LITERATURE,"This character's first literary appearance was in the tragic drama ""The Seducer of Seville"""
LITERATURE,"He wrote the ""2001"", ""2010"", ""2061"" & ""3001"" Odyssey books"
LITERATURE,This Nevil Shute novel depicts the coming annihilation of the human race after a nuclear war
LITERATURE,The 2-word title of this 1985 Bobbie Ann Mason novel refers to the time a soldier spent in Vietnam
LITERATURE,"The title of his 1840 novel ""The Pathfinder"" refers to Natty Bumppo"
LITERATURE,"The sequel to ""Tom Brown's Schooldays"" is called ""Tom Brown at"" this university"
LITERATURE,Natasha Rostova marries Pierre Bezukhov in this classic Tolstoy novel
LITERATURE,"His poems from the Scots Observer were collected in ""Barrack-Room Ballads and Other Verses"""
LITERATURE,"He wrote his 1848 novel ""Dombey and Son"" while living in Switzerland"
LITERATURE,"A 1927 book of short stories by Ernest Hemingway was titled ""Men Without"" these"
LITERATURE,"Poet who wrote, ""Before I built a wall I'd ask to know what I was walling in or walling out"""
LITERATURE,"In James Fenimore Cooper's ""The Pioneers"" Oliver Edwards is this frontiersman's companion"
LITERATURE,"The father of this ""Good-Bye, Mr. Chips"" author was a schoolteacher, not a hotelier"
LITERATURE,"Balzac wrote ""La Comedie Humaine"" in the 1840s & this American wrote ""The Human Comedy"" in the 1940s"
LITERATURE,"Of Pastism, Presentism or Futurism, the literary movement that began around 1909"
LITERATURE,"(<a href=""http://www.j-archive.com/media/2006-11-20_J_12.jpg"" target=""_blank"">Jon of the Clue Crew stands next to a statue in the harbor of Copenhagen, Denmark.</a>) This author once said that ""<a href=""http://www.j-archive.com/media/2006-11-20_J_12a.jpg"" target=""_blank"">The Little Mermaid</a>"" was the only one of his stories he felt moved by when he wrote it"
LITERATURE,"""The Miller's Tale"" is one of the naughtiest of these famous Chaucer stories"
LITERATURE,"The prep school classic ""A Separate Peace"" takes place during this war"
LITERATURE,This scary Edgar Allan Poe story takes place at a spooky masked ball given by a prince
LITERATURE,"Mowgli's song ""Against People"" appears in this author's ""Second Jungle Book"""
LITERATURE,"In chapter 2 of this Tolstoy novel, Princess Bolkonsky says, ""Tell me what this war is about"""
LITERATURE,"This Edgar Allan Poe story concerns ""a masked ball of the most unusual magnificence"""
LITERATURE,"This ""Babbitt"" author published his 1st novel, ""Hike And The Aeroplane"", under the pseudonym Tom Graham"
LITERATURE,"This ""Brave New World"" author's 1921 novel ""Crome Yellow"" abounds with eccentric characters"
LITERATURE,"Chapter 6 of this Hawthorne classic is titled ""Pearl"""
LITERATURE,"Budd Schulberg's novel ""The Harder They Fall"" deals with corrupt practices in this sport"
LITERATURE,"1938's ""Out Of The Silent Planet"" was the first sci-fi novel by this Narnia creator"
LITERATURE,"Published in 1923, ""The Prophet"" is a book of 28 poetic essays by this Lebanese-American"
LITERATURE,"Amory Blaine, a student at Princeton, is the hero of this first novel by F. Scott Fitzgerald"
LITERATURE,"In 1917 L. Frank Baum wrote about ""The Lost Princess of"" this place"
LITERATURE,"When he first saw Becky Thatcher, ""a certain Amy Lawrence vanished out of his heart and left not even a memory"""
LITERATURE,"""I never liked long walks"", says the heroine of this Charlotte Bronte novel"
LITERATURE,"Wordsworth's poem about her begins, ""Hail, Virgin Queen!  O'er many an envious bar triumphant"""
LITERATURE,"Her 1942 novel ""Dragon Seed"" was yet another tale of Chinese peasant farmers"
LITERATURE,"""Grimm"" stories"
LITERATURE,Literary point of view when I write like this
LITERATURE,Language of Chaucer
LITERATURE,"Vowel missing from entire 50,000 word text of Ernest Wright's <a href=""http://www.j-archive.com/media/1984-12-10_DJ_15.mp3"">""Gadsby""</a>"
LITERATURE,"In the '20s, Hemingway & Fitzgerald were among these ""missing"" literary offspring"
LITERATURE,"The next-to-last chapter of this novel is entitled ""The Knitting Done"""
LITERATURE,"His novel ""Sister Carrie"" sold fewer than 500 copies in its first edition"
LITERATURE,This experimental novelist named William published a 1953 account of drug addiction under the name William Lee
LITERATURE,"This novel by Richard Wright tells of Bigger Thomas, the product of a Chicago slum"
LITERATURE,This series of tales by Ovid with a plural title begins with the creation of the world
LITERATURE,Isabel Archer is the title woman of this Henry James masterpiece
LITERATURE,"""Theirs not to reason why, theirs but to do and die"" is from this Tennyson poem"
LITERATURE,"The 1956 novel ""Compulsion"" was based on the story of this duo defended by Darrow"
LITERATURE,"Chingachgook became the last of the Mohicans when this man, his son, died"
LITERATURE,"This Oliver Goldsmith play is subtitled ""The Mistakes of the Night"""
LITERATURE,"He wrote ""Penrod"", ""Penrod and Son"" & ""Penrod Jashber"""
LITERATURE,"At the end of ""Uncle Tom's Cabin"", this sadistic slave owner dies insane"
LITERATURE,"In ""Pudd'nhead Wilson"", Twain wrote, ""Put all your eggs in the one basket and"" then do this to ""that basket"""
LITERATURE,"F. Scott Fitzgerald's 1922 collection of stories was titled ""Tales of"" this ""Age"""
LITERATURE,"A review said this 1979 William Styron novel ""belongs on that small shelf reserved for American masterpieces"""
LITERATURE,"(Sarah of the Clue Crew in New Orleans)  This author of the classic American novel ""Winesburg, Ohio"" once lived here in the Pontalba Apartments on Jackson Square"
LITERATURE,It's where Philip Nolan asked to be buried
LITERATURE,"The final chapter of this classic book is entitled ""Quasimodo's Marriage"""
LITERATURE,"He wrote about Polish life in ""Poland"" & the history of South Africa in ""The Covenant"""
LITERATURE,"Published in 1613, his ""Exemplary Tales"" are believed to be the first short stories written in Castilian"
LITERATURE,A curse placed on one of Nathaniel Hawthorne's ancestors inspired this 1851 novel
LITERATURE,"In this Kipling short story, Daniel Dravot becomes the godlike monarch of an Afghani tribe"
LITERATURE,"Poet John Donne was first to write ""No man is"" this"
LITERATURE,"Bret Harte wrote a short story about ""The Outcasts of"" this mining camp"
LITERATURE,"The Reader's Encyclopedia said, ""He loved the... main streets of America even as he deplored them"""
LITERATURE,"Ayn Rand book that ends with ""Then there was only the ocean and the sky and the figure of Howard Roark"""
LITERATURE,"His eccentric novel ""Tristram Shandy"" contains blank pages & 1-sentence chapters"
LITERATURE,17-year-old Holden Caulfield is the narrator of this acclaimed 1951 novel
LITERATURE,"""Kholstomer"" by this ""War And Peace"" author is a satire on human beings from a horse's point of view"
LITERATURE,"""Mercedes of Castile"" is a lesser-known novel by this author of ""The Leather-Stocking Tales"""
LITERATURE,"His third published novel, ""Sartoris"", was the first he set in Yoknapatawpha County"
LITERATURE,"""The Man of Law's Tale"" in this Chaucer work tells the story of Constance, an emperor's daughter"
LITERATURE,"In this novel, Bill Sikes kills Nancy"
LITERATURE,"His poems include ""Highland Mary"", ""The Banks O' Down"", & ""A Man's A Man For A' That"""
LITERATURE,"""The Silmarillion"", his prequel to ""Lord of the Rings"", was published after his death"
LITERATURE,The color mentioned in the title of Zane Grey's most popular novel
LITERATURE,"Robert Browning wrote, do this ""along with me!  The best is yet to be!"""
LITERATURE,"Maris, Lycon, Laogonus, Erymas, Sarpedon, Erylaus & Patroclus die in Book 16 of this work"
LITERATURE,"In 1852 his story ""The Dandy Frightening the Squatter"" appeared in The Carpet-Bag, a humorous paper"
LITERATURE,"Our copy of this 1865-69 Tolstoy work is 1,444 pages long"
LITERATURE,Many say that Tu Fu was this country's greatest poet
LITERATURE,"(<a href=""http://www.j-archive.com/media/2008-06-30_J_03.jpg"" target=""_blank"">Kelly of the Clue Crew reports from New York's Central Park.</a>) Central Park's Literary Walk features <a href=""http://www.j-archive.com/media/2008-06-30_J_03a.jpg"" target=""_blank"">Robert Burns</a> & <a href=""http://www.j-archive.com/media/2008-06-30_J_03b.jpg"" target=""_blank"">this</a> great novelist & <a href=""http://www.j-archive.com/media/2008-06-30_J_03b.jpg"" target=""_blank"">countryman</a>, both sculpted by John Steell of Aberdeen"
LITERATURE,"In Chaucer's ""The Canterbury Tales"" , this bawdy wife tells of her 5 husbands & her desire for a sixth"
LITERATURE,Flaubert led this movement in French literature also called naturalism
LITERATURE,"William Faulkner's novel ""Mosquitoes"" satirizes the literary life in this Louisiana city"
LITERATURE,"Ford Madox Ford's 4-novel series ""Parade's End"" is set during & after this war in which Ford himself was shell-shocked"
LITERATURE,"""For men may come and men may go, but I go on forever"", this ""Lord"" of poetry babbled in ""The Brook"""
LITERATURE,"This 1871 sequel is subtitled ""Life at Plumfield with Jo's Boys"""
LITERATURE,The title of this Willa Cather novel refers to a certain Ms. Shimerda
LITERATURE,"Death of his son led him to write a ""History of Spiritualism"" before his last Sherlock Holmes book"
LITERATURE,"""A Christmas Carol"" character who tells Scrooge, ""I wear the chain I forged in life"""
LITERATURE,"Narrator of classic tales translated by Sir Richard Burton, or title of <a href=""http://www.j-archive.com/media/1987-02-16_DJ_07.mp3"">this</a> ""suite"" music"
LITERATURE,"19th c. feminist Catharine Beecher wrote ""The American Woman's Home"" with this more famous sister"
LITERATURE,"Subtitled ""A Tale of Acadie"", this Longfellow poem describes the tragic romance of an Acadian woman"
LITERATURE,"Polish-born Jerzy Kosinski wrote all of his novels, including ""Being There"" in this, his adopted language"
LITERATURE,"She based the characters of Anne & Robert in her novel ""The Mandarins"" on herself & Jean-Paul Sartre"
LITERATURE,"It's the native country of Flora Nwapa, who wrote ""This is Lagos, and Other Stories"""
LITERATURE,"The original Italian title of this Umberto Eco novel is ""Il Nome Della Rosa"""
LITERATURE,In 2000 Turkish author Andrew Mango published a new biography of this founder of modern Turkey
LITERATURE,"Cervantes novel that tells us, ""A knight errant without a lady is like...a body without a soul"""
LITERATURE,"He wrote his first novel, ""Murphy"", in 1938, 14 years before his famous play ""Waiting for Godot"""
LITERATURE,"His wife Mary said the caroling of a skylark in Leghorn inspired his poem ""To a Skylark"""
LITERATURE,"""The Knight's Tale"" by this 14th century author is based on Boccaccio's poem ""Teseida"""
LITERATURE,"His 1958 novel ""Our Man in Havana"" takes place in pre-Castro Cuba"
LITERATURE,"Alex Haley's first major work was ""The Autobiography Of"" this black militant leader"
LITERATURE,"Many of the Dublin locales he personally frequented are featured in his book ""Ulysses"""
LITERATURE,"In its original language, this Jules Verne novel is known as ""Vingt mille lieues sous les mers"""
LITERATURE,"""Buffalo Girls"" & ""The Evening Star"" are among this ""Lonesome Dove"" author's recent novels"
LITERATURE,"In 1914, 146 of this late American's poems were published by her niece under the title ""The Single Hound"""
LITERATURE,"Since 1918, the ""O. Henry Awards"" have been given to outstanding examples of this form"
LITERATURE,"The ""History of New York... by Diedrich Kickerbocker"" was actually written by him"
LITERATURE,"The title of this famous Anita Loos work states that they ""Prefer Blondes"""
LITERATURE,"Thomas Mann's ""Magic Mountain"" is set in a Swiss sanatorium for this disease"
LITERATURE,Peter Quint & Miss Jessel are the ghosts in this Henry James ghost story
LITERATURE,"A line from this 1894 Kipling book says, ""Rikki-Tikki had a right to be proud of himself; but he did not grow too proud"""
LITERATURE,"Chapters in this James Bond novel include ""Gem Quality"" & ""Hot Ice"""
LITERATURE,"One reviewer called this recent Sara Gruen bestseller ""so much more than a tale about a circus"""
LITERATURE,"He wrote ""Bech: A Book"", ""Bech Is Back"" & ""Bech At Bay"" in addition to his ""Rabbit"" novels"
LITERATURE,This 1930 William Faulkner novel deals with the death & burial of Addie Bundren
LITERATURE,"This title character's ship, the Antelope, went down off the coast of Lilliput"
LITERATURE,"In a 1927 Hermann Hesse novel, newspaper writer Harry Haller, a loner, calls himself this"
LITERATURE,"Hamlet's most famous one of these speeches includes the following lines <i>Whether tis' nobler in the mind to suffer the slings & arrows of outrageous fortune, or to take arms against a sea of troubles & by opposing...</i>"
LITERATURE,John Kennedy Toole immortalized the Lucky Dog vending carts in this Pulitzer Prize-winning novel
LITERATURE,Nelson Algren won a 1950 Nat'l Book Award for this novel about card dealer & morphine addict Frankie Machine
LITERATURE,"1952 novel that begins off the coast of Cuba, & ends on shore 3 days later"
LITERATURE,"In a Defoe novel, this companion is described as ""a comely handsome fellow"""
LITERATURE,"""Jo's Boys"" was the second sequel to this 19th century novel"
LITERATURE,"Chapter 48 of this English novel deals with ""The Flight of Sikes""--Bill Sikes"
LITERATURE,"Richard Middlemas gets crushed by an elephant in ""The Surgeon's Daughter"", an 1827 tale by this Edinburgher"
LITERATURE,"The NYC murder of Mary Rogers inspired Poe, who changed the setting to Paris & created ""The Mystery of"" her"
LITERATURE,"In 1923 Vladimir Nabokov translated ""Alice In Wonderland"" into this language"
LITERATURE,"Ernest Hemingway's novel ""For Whom The Bell Tolls"" takes place during this country's Civil War"
LITERATURE,"First published in 1835, ""Berence"" has been called ""his most horrifying tale"""
LITERATURE,"He may have put his rabbit to rest, but in 1996 he published a new family saga, ""In The Beauty Of The Lilies"""
LITERATURE,"""Buddenbrooks"" was the first important novel by this 20th century German author"
LITERATURE,"Charles Dickens ended this story with the line ""God bless us, every one!"""
LITERATURE,"""The Last Temptation Of Christ"" has this many chapters, the traditional number of years of Jesus' life"
LITERATURE,"In ""The Legend Of Sleepy Hollow"", Abraham Van Brunt, a rival of Ichabod Crane, is better known by this name"
LITERATURE,"To research this novel, Irving Stone stayed in Van Gogh's asylum cell"
LITERATURE,"Paul Riesling, this Sinclair Lewis realtor's one true friend, shoots his wife & is sent to prison"
LITERATURE,"This English lord dedicated an 1880 volume of poetry to his grandson, who was also named Alfred"
LITERATURE,"His famous story ""The Tell-Tale Heart"" tells us, ""It was not the old man who vexed me, but his evil eye"""
LITERATURE,18-year-old Carrie Meeber leaves her Wisconsin home & moves to Chicago in this Theodore Dreiser novel
LITERATURE,"In this Orwell novel, the  Ministry of Peace, also known as Minipax, concerns itself with war"
LITERATURE,"In the last years of his life, he devoted many of his working hours to ""Finnegans Wake"""
LITERATURE,"James Fenimore Cooper's 1823 novel ""The Pioneers"" was the first in a series of these 5 ""Tales"""
LITERATURE,"In 1919 Booth Tarkington won a Pulitzer Prize for this ""Magnificent"" novel; in 1922 he won again for ""Alice Adams"""
LITERATURE,"In this 1952 short story, Hemingway wrote, ""A man can be destroyed but not defeated"""
LITERATURE,"In ""A Scandal in"" this, Sherlock Holmes calls Dr. Watson his ""Boswell"""
LITERATURE,"Graham Greene's ""A Gun For Sale"" was published in the U.S. under this title"
LITERATURE,"Northumbria in the ""Age of Bede"" or Mercia in Offa's reign are guesses as to where & when this work was created"
LITERATURE,"This Dickens novel about a foundling is subtitled ""The Parish Boy's Progress"""
LITERATURE,"His ""Anna Karenina"" was originally published in installments between 1875 & 1877"
LITERATURE,"It's the English title of Isabel Allende's novel ""La Casa de los Espiritus"""
LITERATURE,"William Dean Howells wrote of Silas Lapham & she wrote of ""Silas Marner"""
LITERATURE,In this 1979 book Norman Mailer told the story of convicted killer Gary Gilmore
LITERATURE,"Henry Fielding called a 1749 novel ""The History of"" him, ""a Foundling"""
LITERATURE,"An 1894 Anthony Hope romance was titled this ""of Zenda"""
LITERATURE,1868 Wilkie Collins novel about a mysterious rock
